{
  "$schema": "https://json-schema.org/draft/2020-12/schema",
  "$id": "https://registry.adhf.dev/schemas/v1/channels/channel-manifest.schema.json",
  "title": "Provider channel manifest — v1",
  "description": "Immutable provider artifact channel manifest. One file per channel under channels/<channel>.json; channels are data namespaces in this repo, not branches. Stage 1 is schema/data only: no runtime loading or activation. See docs/provider-channels.md for canonical digest semantics and the digestAlgorithm migration path.",
  "type": "object",
  "required": ["schemaVersion", "channel", "publishedAt", "providers"],
  "additionalProperties": false,
  "properties": {
    "$schema": {
      "type": "string",
      "description": "JSON Schema URL — optional, lets editors validate the file. Conventionally https://registry.adhf.dev/schemas/v1/channels/channel-manifest.schema.json."
    },
    "schemaVersion": {
      "const": 1,
      "description": "Manifest schema version. Unknown versions are rejected (fail closed)."
    },
    "channel": {
      "enum": ["stable", "preview"],
      "description": "Channel namespace. Must also match the filename channels/<channel>.json; absent or ambiguous channel data fails validation."
    },
    "publishedAt": {
      "type": "string",
      "format": "date-time",
      "description": "ISO 8601 timestamp of manifest publication. Manifests are immutable once published; corrections ship as a new manifest version."
    },
    "providers": {
      "type": "array",
      "minItems": 1,
      "description": "Provider artifacts in this channel. providerType+providerVersion is unique within a channel.",
      "items": {
        "type": "object",
        "required": ["providerType", "providerVersion", "category", "bundleDigest", "digestAlgorithm", "publishedAt"],
        "additionalProperties": false,
        "properties": {
          "providerType": {
            "type": "string",
            "pattern": "^[a-z][a-z0-9-]*$",
            "description": "Stable provider identifier. Matches the provider.json `type` field and the registry.json key. Lowercase kebab-case."
          },
          "providerVersion": {
            "type": "string",
            "pattern": "^\\d+\\.\\d+\\.\\d+$",
            "description": "Provider package SemVer. Must equal the artifact manifest's providerVersion."
          },
          "category": {
            "enum": ["ide", "extension", "cli", "acp", "driver"],
            "description": "Provider category; determines the artifact directory <category>/<dir>/."
          },
          "name": {
            "type": "string",
            "minLength": 1,
            "description": "Human-readable name copied from the artifact manifest (informational)."
          },
          "bundleDigest": {
            "type": "string",
            "pattern": "^sha256:[0-9a-f]{64}$",
            "description": "Canonical content digest of the provider bundle, lowercase hex sha256 with explicit algorithm prefix. The same canonical bundle yields exactly one digest across machines; anything not matching ^sha256:[0-9a-f]{64}$ is rejected."
          },
          "digestAlgorithm": {
            "enum": ["adhdev-provider-tree-sha256-v1"],
            "description": "How the canonical digest input is constructed. Stage 1 uses 'adhdev-provider-tree-sha256-v1' (tracked provider directory tree; see docs/provider-channels.md). A later packaging stage will introduce a canonical-bundle algorithm; unknown algorithms fail closed."
          },
          "compatibility": {
            "type": "object",
            "additionalProperties": false,
            "description": "Compatibility bounds/metadata declared by the current provider artifact.",
            "properties": {
              "contractVersion": {
                "type": "integer",
                "minimum": 1,
                "description": "Typed contract version declared by the artifact, when present."
              },
              "ideVersion": {
                "type": "array",
                "minItems": 1,
                "items": { "type": "string", "minLength": 1 },
                "description": "IDE/host SemVer ranges declared by the artifact's compatibility entries, deduplicated and sorted. Each must parse as a valid SemVer range."
              }
            }
          },
          "publishedAt": {
            "type": "string",
            "format": "date-time",
            "description": "ISO 8601 timestamp this entry was published to the channel."
          },
          "promotedFrom": {
            "type": "object",
            "additionalProperties": false,
            "required": ["channel", "bundleDigest"],
            "description": "Optional provenance for promoted entries. Promotion copies the identical bundleDigest and never rebuilds: promotedFrom.bundleDigest must equal this entry's bundleDigest, and the source channel must differ from this manifest's channel.",
            "properties": {
              "channel": {
                "enum": ["stable", "preview"],
                "description": "Source channel the artifact was promoted from (e.g. preview for a stable entry)."
              },
              "bundleDigest": {
                "type": "string",
                "pattern": "^sha256:[0-9a-f]{64}$",
                "description": "Digest recorded in the source channel. Must equal this entry's bundleDigest."
              },
              "promotedAt": {
                "type": "string",
                "format": "date-time",
                "description": "ISO 8601 timestamp of promotion."
              }
            }
          }
        }
      }
    }
  }
}
