{
  "$schema": "https://registry.adhf.dev/schemas/v1/channels/channel-manifest.schema.json",
  "schemaVersion": 1,
  "channel": "preview",
  "publishedAt": "2026-10-23T12:56:38.273Z",
  "providers": [
    {
      "providerType": "antigravity",
      "providerVersion": "1.0.1",
      "category": "ide",
      "bundleDigest": "sha256:378bf254af185298917a481bd32ec93686fa5824f098028a06ce57ab54d64266",
      "digestAlgorithm": "adhdev-provider-tree-sha256-v1",
      "publishedAt": "2026-10-23T12:56:38.273Z",
      "name": "Antigravity",
      "compatibility": {
        "contractVersion": 2,
        "ideVersion": [
          ">=1.0.0"
        ]
      }
    },
    {
      "providerType": "antigravity-cli",
      "providerVersion": "1.2.28",
      "category": "cli",
      "bundleDigest": "sha256:8c47164d0c47304e98baf167257a372368d86afdd58b1487175c926e32fc9200",
      "digestAlgorithm": "adhdev-provider-tree-sha256-v1",
      "publishedAt": "2026-10-23T12:56:38.273Z",
      "name": "Antigravity CLI",
      "compatibility": {
        "ideVersion": [
          ">=1.0.0"
        ]
      }
    },
    {
      "providerType": "claude-cli",
      "providerVersion": "1.2.23",
      "category": "cli",
      "bundleDigest": "sha256:71345c85116aa0596421068337ca95ecf734231fda54d7c4aeebb5c3667d62b4",
      "digestAlgorithm": "adhdev-provider-tree-sha256-v1",
      "publishedAt": "2026-10-23T12:56:38.273Z",
      "name": "Claude Code",
      "compatibility": {
        "ideVersion": [
          ">=2.1.0"
        ]
      }
    },
    {
      "providerType": "claude-code-vscode",
      "providerVersion": "1.0.1",
      "category": "extension",
      "bundleDigest": "sha256:52c9b51f58bc11edf8e8d500b29ac2cf8afdb1950253c9cb8843cdf9f7224fcc",
      "digestAlgorithm": "adhdev-provider-tree-sha256-v1",
      "publishedAt": "2026-10-23T12:56:38.273Z",
      "name": "Claude Code (VS Code)",
      "compatibility": {
        "contractVersion": 2
      }
    },
    {
      "providerType": "cline",
      "providerVersion": "1.0.1",
      "category": "extension",
      "bundleDigest": "sha256:6ee6df25ba82b0c73a7b4f067f386c63db11d99e263b5da2fd77cd03160a77a6",
      "digestAlgorithm": "adhdev-provider-tree-sha256-v1",
      "publishedAt": "2026-10-23T12:56:38.273Z",
      "name": "Cline",
      "compatibility": {
        "contractVersion": 2
      }
    },
    {
      "providerType": "codex",
      "providerVersion": "1.0.1",
      "category": "extension",
      "bundleDigest": "sha256:c2fd29992ec8245ad84c41889a4529ceb3cc6452a0516b18ecc6fefaef939d42",
      "digestAlgorithm": "adhdev-provider-tree-sha256-v1",
      "publishedAt": "2026-10-23T12:56:38.273Z",
      "name": "Codex",
      "compatibility": {
        "contractVersion": 2
      }
    },
    {
      "providerType": "codex-cli",
      "providerVersion": "1.1.35",
      "category": "cli",
      "bundleDigest": "sha256:f1e087a09cf2f87f83cc40358719ea28a5b4bba62278f32e669c9f41b7243159",
      "digestAlgorithm": "adhdev-provider-tree-sha256-v1",
      "publishedAt": "2026-10-23T12:56:38.273Z",
      "name": "Codex CLI",
      "compatibility": {
        "ideVersion": [
          ">=0.137.0",
          ">=0.42.0"
        ]
      }
    },
    {
      "providerType": "cursor",
      "providerVersion": "1.0.1",
      "category": "ide",
      "bundleDigest": "sha256:b9c80232666d2d2eae392dc520147cf4d84fcb15af3474791b58c7bbf13c93ca",
      "digestAlgorithm": "adhdev-provider-tree-sha256-v1",
      "publishedAt": "2026-10-23T12:56:38.273Z",
      "name": "Cursor",
      "compatibility": {
        "contractVersion": 2,
        "ideVersion": [
          ">=1.0.0"
        ]
      }
    },
    {
      "providerType": "cursor-cli",
      "providerVersion": "1.0.16",
      "category": "cli",
      "bundleDigest": "sha256:05952ff0d2482f2b4fd69fb4a98b946586aea14a0b2b632b59905da91f3ec94e",
      "digestAlgorithm": "adhdev-provider-tree-sha256-v1",
      "publishedAt": "2026-10-23T12:56:38.273Z",
      "name": "Cursor Agent",
      "compatibility": {
        "ideVersion": [
          ">=2026.0.0"
        ]
      }
    },
    {
      "providerType": "grok-cli",
      "providerVersion": "1.0.15",
      "category": "cli",
      "bundleDigest": "sha256:5a0446bc10b0fad365214a3f560be75dd4d4e9995699d8290fd8bfdac7a83a9e",
      "digestAlgorithm": "adhdev-provider-tree-sha256-v1",
      "publishedAt": "2026-10-23T12:56:38.273Z",
      "name": "Grok CLI",
      "compatibility": {
        "ideVersion": [
          ">=1.0.0"
        ]
      }
    },
    {
      "providerType": "kimi",
      "providerVersion": "1.0.20",
      "category": "cli",
      "bundleDigest": "sha256:e1a287bab1f15ec5d180699979f13610bd0374787112c09d262cfe1b5b1d492a",
      "digestAlgorithm": "adhdev-provider-tree-sha256-v1",
      "publishedAt": "2026-10-23T12:56:38.273Z",
      "name": "Kimi Code",
      "compatibility": {
        "ideVersion": [
          ">=0.20.0"
        ]
      }
    },
    {
      "providerType": "kiro",
      "providerVersion": "1.0.1",
      "category": "ide",
      "bundleDigest": "sha256:2bba76035b0f1802a189503e74da8863a0dc17d3e97e9dc9e62cec315df78371",
      "digestAlgorithm": "adhdev-provider-tree-sha256-v1",
      "publishedAt": "2026-10-23T12:56:38.273Z",
      "name": "Kiro",
      "compatibility": {
        "contractVersion": 2
      }
    },
    {
      "providerType": "opencode",
      "providerVersion": "1.0.11",
      "category": "cli",
      "bundleDigest": "sha256:e640006cd5dbff70c77caee0edc406ac65fa2832e4e5fadb9d7891453fa26ad9",
      "digestAlgorithm": "adhdev-provider-tree-sha256-v1",
      "publishedAt": "2026-10-23T12:56:38.273Z",
      "name": "OpenCode",
      "compatibility": {
        "ideVersion": [
          ">=1.0.0"
        ]
      }
    },
    {
      "providerType": "pearai",
      "providerVersion": "0.0.1",
      "category": "ide",
      "bundleDigest": "sha256:f1cc0c07aec1044503834241e677c7e8589e59f031260167ccb927dd721e98ab",
      "digestAlgorithm": "adhdev-provider-tree-sha256-v1",
      "publishedAt": "2026-10-23T12:56:38.273Z",
      "name": "PearAI",
      "compatibility": {
        "contractVersion": 2,
        "ideVersion": [
          ">=1.0.0"
        ]
      }
    },
    {
      "providerType": "roo-code",
      "providerVersion": "1.0.1",
      "category": "extension",
      "bundleDigest": "sha256:4799316c0862ce90102ca7bb66c373d521c915646aa88cde741a1ae1e0f1d441",
      "digestAlgorithm": "adhdev-provider-tree-sha256-v1",
      "publishedAt": "2026-10-23T12:56:38.273Z",
      "name": "Roo Code",
      "compatibility": {
        "contractVersion": 2
      }
    },
    {
      "providerType": "trae",
      "providerVersion": "0.0.1",
      "category": "ide",
      "bundleDigest": "sha256:8b7b5dd79b08c01e7fbb70a448951e6749d96d79d91d377c24b16601f9acf81e",
      "digestAlgorithm": "adhdev-provider-tree-sha256-v1",
      "publishedAt": "2026-10-23T12:56:38.273Z",
      "name": "Trae",
      "compatibility": {
        "contractVersion": 2,
        "ideVersion": [
          ">=1.0.0"
        ]
      }
    },
    {
      "providerType": "vscode",
      "providerVersion": "1.0.1",
      "category": "ide",
      "bundleDigest": "sha256:b8fa7b3f7f47c1c2ff30d0f2ce196228d3551ff6e55034398c6886b575c21227",
      "digestAlgorithm": "adhdev-provider-tree-sha256-v1",
      "publishedAt": "2026-10-23T12:56:38.273Z",
      "name": "Visual Studio Code",
      "compatibility": {
        "contractVersion": 2,
        "ideVersion": [
          ">=1.0.0"
        ]
      }
    },
    {
      "providerType": "vscodium",
      "providerVersion": "0.0.1",
      "category": "ide",
      "bundleDigest": "sha256:314bd745570c78090ee2d0f6576e65377b234ef66b89e332591a12dcf81289ee",
      "digestAlgorithm": "adhdev-provider-tree-sha256-v1",
      "publishedAt": "2026-10-23T12:56:38.273Z",
      "name": "VSCodium",
      "compatibility": {
        "contractVersion": 2,
        "ideVersion": [
          ">=1.0.0"
        ]
      }
    },
    {
      "providerType": "windsurf",
      "providerVersion": "1.0.1",
      "category": "ide",
      "bundleDigest": "sha256:0166a036216ffcd50c020c2060a95d2c7ea2209b62db2c2507e4bff9863c004d",
      "digestAlgorithm": "adhdev-provider-tree-sha256-v1",
      "publishedAt": "2026-10-23T12:56:38.273Z",
      "name": "Windsurf",
      "compatibility": {
        "contractVersion": 2,
        "ideVersion": [
          ">=1.0.0"
        ]
      }
    }
  ]
}
